Author,EndDate,Site,StartDate,Text,Title
Mark Kolakowski,05252017,Investopedia,05182017,"Find the best broker for your trading or investing needs With nearly all companies in the S&P 500 Index (SPX) reporting first quarter profits, aggregate earnings for companies in the index are trending towards a 13.6% gain versus the same period in 2016, according to data from FactSet cited by the Wall Street Journal. This would be the biggest year-over-year profit increase since the third quarter of 2011, the Journal adds, and is a driving factor in the S&P 500's year-to-date gain of 7.6% through Thursday's open. Among the encouraging signs for investors are two things. The first is the large number of companies announcing high-quality earnings: these are profits fueled by strong fundamental revenue and unit sales growth as opposed to short-term earnings oilers such as stock buybacks and accelerating or delaying key writeoffs or charges to make a specific quarter look good - or less bad. The second positive sign is the broad-based nature of the profit surge. While financial and technology companies are among those showing the greatest earnings improvements, 10 of the 11 S&P 500 industry sectors nonetheless are poised to show gains, per the same FactSet data cited by the Journal. Moreover, an upward trend in profits is underway. S&P 500 profits now have improved in three consecutive quarters, and analysts are projecting another 6.8% year-over-year earnings increase for the second quarter, while forecasting that the full year will clock in with an 11% improvement versus 2016, also according to FactSet and the Journal. As evidence of how diversified the profit gains are by industry, among the companies mentioned by the Journal for noteworthy performance are social networking leader Facebook Inc. (FB), multinational petroleum exploration, refining and marketing colossus Exxon Mobil Corp. (XOM), heavy construction equipment manufacturer Caterpillar Inc. (CAT) and financial giant Bank of America Corp. (BAC), the corporate parent of Merrill Lynch. The year-to-date changes in these companies' stock prices through Thursday's open are, respectively, +30.7%, -7.1%, +14.6% and +6.3%. Facebook recorded $3.06 billion in first quarter profits, up a breathtaking 76% from the same period in 2016, the Journal says. The company's user base is growing, and advertising dollars are flooding in as a result. (For more, see also: Why Mega Tech Stocks Will Win Longterm.) Caterpillar's first quarter revenues and earnings ""smashed Wall Street's expectations,"" according to CNBC. Earnings per share (EPS) came in at $1.28, 106% above the consensus estimate of $0.62, and revenue was $9.822 billion, 5.9% better than the estimate of $9.271 billion, per Thomson Reuters data cited by CNBC. The company finally saw an uptick in demand as an economic recovery progresses around the globe, while also benefiting from cost cutting, Forbes reports.  Bank of America enjoyed a 40% profit boost year-over-year. Key factors were increases in securities trading revenues and net interest income, the result of rising interest rates, as the Journal explains in another article. Exxon Mobil reported its best quarterly results since 2015, and more than doubled its profits versus the first quarter of 2016, when crude oil prices sank to their lowest level in over a decade, as another Journal story details. However, though crude oil prices are up versus a year ago, they have slipped so far this year, pulling the shares of Exxon Mobil and other energy companies downward. Meanwhile, energy is among those sectors that posted impressive earnings gains year-over-year precisely because the year-ago period was so bad, the Journal cautions. Benchmark West Texas Intermediate (WTI) crude bottomed out at $29.42 per barrel on January 15, 2016, recovered to $53.72 by December 30, 2016, but opened Thursday at $51.25, down 4.6% for the year-to-date, per Bloomberg Markets data. (For more, see also: Why Oil Prices Could Double to $90.)  ","How Facebook, Exxon, Caterpillar Fuel S&P's Rise (FB, XOM, CAT) | Investopedia"
 ,05252017,CNBC,05182017,"A New York state appeals court on Tuesday ruled that Exxon Mobil Corp should be compelled to turn over records in an investigation into how much the company knew about global warming as it continued to publicly downplay the effects it was expected to have on the fossil fuel industry. Exxon has been battling subpoenas from New York Attorney General Eric Schneiderman, who is probing the company for fraud in its public statements about climate change. The appeals court upheld a lower court's decision, rejecting Exxon's argument that the court did not properly consider which state's laws on turning over evidence in an investigation should apply in the case. The investigation is taking place in New York, but Exxon's headquarters are in Texas. ""We respect, but disagree with the court's decision and are assessing our options and potential next steps,"" said Scott Silvestri, an Exxon spokesman. ""The unanimous appeals court rightly affirmed the lower court's decision and rejected Exxon's frivolous claims, which were merely one of the many tactics the company has employed in its campaign of delay and distraction,"" said Schneiderman's spokeswoman, Amy Spitalnick. Exxon is also fighting the investigation in Manhattan federal court, arguing Schneiderman and Massachusetts Attorney General Maura Healey, who is conducting a separate probe, are motivated by politics. On Friday, Schneiderman asked a judge to dismiss Exxon's case. The investigation has already led to one public revelation: that Secretary of State Rex Tillerson, who until December was chief executive of Exxon, used a separate email address and an alias, ""Wayne Tracker,"" to discuss climate change-related issues while at the company. In his filing in federal court on Friday, Schneiderman revealed his office had interviewed witnesses who could help them learn more about the kind of records Exxon might have showing internal discussions about climate change. He described the move as an attempt to keep Exxon from destroying relevant records before they were required to be turned over in the investigation. The cases are People of the State of New York v PricewaterhouseCoopers and Exxon Mobil Corporation, New York State Supreme Court, New York County, No. 451962/2016, and 1:17-cv-2301 in U.S. District Court, Southern District of New York. ","Exxon must give records to NY prosecutor, state appeals court rules"
Brian Richards,05252017,Fool,05182017,"Founded in 1993 by brothers Tom and David Gardner, The Motley Fool helps millions of people attain financial freedom through our website, podcasts, books, newspaper column, radio show, and premium investing services. It's a quick and fascinating read, both a point-in-time snapshot of a market at peak madness, and a timeless overview of Japanese business and investor attitudes and sensibilities. Image Source: Getty Images. Even though it was published near the Nikkei's apogee -- a level it hasn't sniffed in the 25-plus years since -- the book is guarded and balanced on those lofty levels (qualities not present in another peak-bubble book I've reviewed). As you can see below, 1989 was right about the top of the roller coaster: What follows are some of the fascinating things I learned, a few of which are quite relevant today. In early 1989, by market cap, Japan accounted for 45% of the global stock market, followed by the U.S. at 33% and the U.K. at 9%. In 2017, the U.S. represents 53% of global stock market capitalization. Japan, in   second place, has fallen all the way down to 8.4%. The U.K. remains in third, at 6.2%. Today, the 10 largest public companies in the world by market cap are all American. Apple, by market cap, is nine times larger than NTT (market value: about $90 billion according to data from S&P Market Intelligence). That's a pretty incredible shift in global fortunes, all in a span of just the past 30 years. It reminds me of the adage that ""all investing is active investing."" Imagine for a second that index investing had been popular back then, and ""total world stock index"" investors had sat back and let their bets ride along with the market over the ensuing years -- a world market dominated by Japan. This book has reminded me that past returns are no guarantee of future results, and that a ""passive"" approach of buying the S&P 500 is actually quite an active investment choice. Consider: In 1987, four of the top 10 companies granted U.S. patents were Japanese (including numbers 1-3). Interestingly, in 2015, the latest year for which data is available, that situation hasn't changed much: Canon, Toshiba, and Sony were among the top 10 recipients of patents from the U.S. Patent and Trademark office. In early 1989, the average price-to-earnings (P/E) ratio for all stocks on the Tokyo Stock Exchange first section was around 58. Today, on an index-weight basis, the Nikkei 225 is trading for about 18 times earnings. It was quite common for company A to buy company B's shares, and vice-versa. It was a way of strengthening ties with between companies and their suppliers, banks, customers, vendors, you name it. Back then, Roth wrote, ""Toyota Motor lists on its books holdings of 853 million shares in nearly 300 companies (not including subsidiaries). Such shares seldom trade."" Deutsche Bank has sold its remaining stake in Daimler AG in one of the final steps toward unwinding 'Germany Inc,' a once powerful system of cross-shareholdings in Europe's largest economy. ... Just 13 years ago, 60 of Germany's 100 biggest companies belonged to the shareholding network, set up as a tool to protect German companies from foreign takeover and provide support in the event of large-scale bankruptcies. Consider, via Roth's book: Score one for skeptical publications. The Tokyo Stock Exchange is 'probably the most cynical, speculative, and manipulative major stock market in the world. Its traders are interested in the quantity, not the quality, of buying interest. The key factors in any day's trading are herd instinct, ramping, and brokers' 'stories' about what to buy for which usually spurious reason. Roth is unkind to the Pollyannaish local media: The stock press views itself as an integral part of the market, to which it displays a relentlessly optimistic posture. When stocks are moving up it is their biggest cheerleader; when they start falling the papers wonder out loud when it will be time to buy again. Look again at the post-World War 2 to 1989 rise! In just the 1980s, Roth writes, ""$10,000 invested in Japanese stocks in 1982 would by early 1989 have grown to around $100,000, thanks to the simultaneous skyrocketing of the Japanese stock market and the yen."" In today's low-yield environment, this may sound eerily similar: ""An investor in many Western countries can garner a good return from secure government bonds or even a long-term bank deposit. But in Japan the stock market is one of the few places where investors can hope to receive a return on their investment of more than a few percent a year."" The way people in the late 1980s talked about Nomura sounds a lot like how people talk about Goldman Sachs today... Here's Matt Taibbi's famous Rolling Stone lede from ""The Great American Bubble Machine"": The first thing you need to know about Goldman Sachs is that it's everywhere. The world's most powerful investment bank is a great vampire squid wrapped around the face of humanity, relentlessly jamming its blood funnel into anything that smells like money. Roth doesn't have Taibbi's prose skills, but he paints a similar picture of Nomura circa 1989: For some observers ... the name is unloved. Others take a more extreme view, believing the company exercises some demon-like control over the entire Japanese financial establishment. Though like Goldman today, Nomura was simultaneously hated and revered: ""But many admire -- and openly stand in awe of -- the way in which the company has so successfully ... transformed itself into a financial powerhouse capable of taking on the world."" Fun fact: In the late 1980s, more Oxford and Cambridge graduates worked for Nomura than for any institution other than the U.K. government. This table outlining the differences in living standards is eye-opening: We know how the story of the Tokyo bull market ended. But reading a book that was published when Japan's stock market was at its zenith has been a valuable reminder of the stories we were telling ourselves (or actively avoiding) back then, and the emotions that fueled that epic run-up. Credit to Martin Roth for writing a book that's far less dated than I expected when I ordered it from a used bookstore. ","
      
    14 Fascinating Facts About Japanese Stocks -- From 1989 -- The Motley Fool

  "
