Author,EndDate,Site,StartDate,Text,Title
 ,04272017,Reuters,04202017,"Blueknight Energy Partners, L.P., incorporated on February 22, 2007, is a master limited partnership company. The Company provides integrated terminaling, storage, gathering and transportation services for companies engaged in the production, distribution and marketing of crude oil and liquid asphalt cement. It manages its operations through four segments: asphalt terminaling services, crude oil terminaling and storage services, crude oil pipeline services, and crude oil trucking and producer field services. Asphalt terminaling services Asphalt terminaling services segment operations generally consist of fee based activities associated with providing storage, terminaling and throughput services for asphalt product and residual fuel oil. As of December 31, 2016, the Company's 54 asphalt terminals were located in 26 states and are positioned to provide asphalt terminaling services in the market areas they serve throughout the continental United States. As of December 31, 2016, with approximately 9.6 million barrels of total asphalt product and residual fuel oil storage capacity, the Company was focused on providing its customers the ability to manage their asphalt product storage and processing and marketing activities. The Company has storage contracts or leases with customers for all of its asphalt facilities. Crude oil terminaling and storage Crude oil terminaling and storage segment operations generally consist of fee based activities associated with providing storage, terminaling, and throughput services for crude oil. The Company provides crude oil terminaling and storage services at its terminaling and storage facilities located in Oklahoma and Texas. It owned and operated an aggregate of approximately 7.4 million barrels of storage capacity, as of December 31, 2016. As of December 31, 2016, of this storage capacity, approximately 6.6 million barrels were located at its terminal in Cushing, Oklahoma. Its Cushing terminal is located within the Cushing Interchange, a crude oil marketing hub in the United States and the designated point of delivery specified in all New York Mercantile Exchange (NYMEX) crude oil futures contracts. Its terminals had a combined capacity to receive or deliver approximately 10 million barrels of crude oil per month, as of December 31, 2016. As of December 31, 2016, it also owned approximately 50 acres of additional land within the Cushing Interchange, where it can develop additional storage capacity. Crude oil pipeline services Crude oil pipeline services segment operations generally consist of fee-based activity associated with transporting crude oil products on pipelines. As of December 31, 2016, the Company owned and operated two pipeline systems, the Mid-Continent system and the East Texas system, collectively consisting of approximately 760 miles of pipelines that gather crude oil for its customers and transport it to refiners, to common carrier pipelines for ultimate delivery to refiners or to terminaling and storage facilities owned by the Company and others. Its pipeline system located in Oklahoma and the Texas Panhandle, referred as the Mid-Continent system, had a combined length of approximately 550 miles, as of December 31, 2016. Its second pipeline gathering and transportation system located in East Texas, referred to as the East Texas system, consisted of approximately 210 miles of tariff-regulated crude oil gathering pipeline, as of December 31, 2016. Crude oil trucking and producer field services Crude oil trucking and producer field services segment operations generally consist of fee-based activity associated with transporting crude oil products on trucks. As of December 31, 2016, in addition to its pipelines, the Company used its approximately 125 owned or leased tanker trucks to gather crude oil in Kansas, Oklahoma, Texas, New Mexico and Colorado for its customers at remote wellhead locations generally not connected to pipeline and gathering systems and transport the crude oil to aggregation points and storage facilities located along pipeline gathering and transportation systems. In connection with its gathering services, the Company also provides a number of producer field services, ranging from gathering condensates from natural gas producers to hauling production waste water to disposal wells. As of December 31, 2016, its producer service fleet consisted of approximately 80 trucks in a number of different sizes. The Company competes with BP p.l.c., Flint Hills Resources, L.P., CHS, Inc., Exxon Mobil Corporation, ConocoPhillips Co., NuStar Energy L.P., Ergon, Inc., Marathon Petroleum Company LLC, Alon USA LP, Suncor Energy Inc., Valero Energy Corporation, Associated Asphalt Partners, LLC, Idaho Asphalt Supply, Inc., Asphalt Materials, Inc., Old Castle Materials, Inc., Colas SA, KinderMorgan Inc., International-Matex Tank Terminals, Houston Fuel Oil Terminal Company, Enterprise Products Partners L.P., Plains All American Pipeline, L.P., Magellan Midstream Partners, L.P., Sunoco Logistics Partners L.P., Rose Rock Midstream Partners, L.P. and Enbridge Energy Partners, L.P. 201 NW 10th St Ste 200OKLAHOMA CITY   OK   73103-3928
P: +1405.2786400F: +1302.6555049 Reuters, the news and media division of Thomson Reuters, is the world’s largest international multimedia news provider reaching more than one billion people every day. Reuters provides trusted business, financial, national, and international news to professionals via Thomson Reuters desktops, the world's media organizations, and directly to consumers at Reuters.com and via Reuters TV.  Learn more about Thomson Reuters products: All quotes delayed a minimum of 15 minutes. See here for a complete list of exchanges and delays. ",Blueknight Energy Partners LP (BKEP.A)  Company Profile | Reuters.com
Fred Imbert,04272017,CNBC,04202017,"U.S. equities soared on Monday as investors cheered the results of the first round in the French presidential election. ""The market really seemed to like"" the election outcome, said Randy Warren, chief investment officer at Warren Financial. ""It really surprised me because the other candidate is Le Pen and she's the sleeper candidate."" The Dow Jones industrial average soared more than 200 points, with Goldman Sachs and JPMorgan Chase contributing the most gains. The S&P 500 popped about 1 percent, with financials surging more than 2 percent to lead advancers. The SPDR S&P Bank ETF (KBE) and the Regional Banking ETF (KRE) both rose more than 2 percent. The Nasdaq composite posted record highs on an intraday and closing basis, rising more than 1 percent. Early results from the French election showed Emmanuel Macron and Marine Le Pen advancing to a presidential runoff. Far-right candidate Le Pen and centrist Macron were largely expected to pull ahead in the first round of the French contest. The two had led most of the polls leading up to the election. Le Pen and Macron will face off again on May 7. Most polls show Macron easily beating Le Pen in the second round. ""While I don't believe the US stock market was worried whatsoever about the French election in terms of its pricing and recent action ... it's clear that we dodged a bullet with the high likelihood of a Macron Presidency,"" said Peter Boockvar, chief market analyst at The Lindsey Group, in a note. European stock markets skyrocketed across the board, with the pan-European Stoxx 600 index popping about 2 percent. The French CAC 40 rose 4.14 percent and hit a nine-year high. The euro also rose sharply against most major currencies. The common currency briefly broke above $1.09 against the U.S. dollar and last traded around 1.3 percent higher at $1.087. Macron ""is the prohibitive favorite to win the presidency in two weeks thereby leaving far too little time for his challenger to make up any significant ground,"" said Jeremy Klein, chief market strategist at FBN Securities. ""Although the outcome hardly qualifies as a surprise, investors breathed a huge sigh of relief."" U.S. stock futures rose more than 1 percent in the premarket. ""We've certainly seen the French election give risk assets a boost,"" said Chris Gaffney, president of EverBank World Markets. ""But now you're seeing the narrative shift almost immediately to the possibility of a government shutdown."" That said, investors are also staring down the barrel of a potential government shutdown. Government funding will end Friday unless Congress can agree on at least a temporary funding resolution. The last time the government shut down was Oct. 1 through 16, 2013. During that time, the S&P 500 rose about 1.6 percent, but not without some volatility. The index moved more than 1 percent three times in that time period. ""There's a lot of anxiety over a government shutdown. One would hope we learned from the last time we went through this,"" said Bruce McCain, chief investment strategist at Key Private Bank. The possibility of a shutdown comes as President Donald Trump is about to conclude his first 100 days in office. On Monday, Dow Jones reported that Trump ordered aides to put together a tax plan to cut the corporate tax rate to 15 percent. Expectations of tax reform have been one of the pillars of the stock market's postelection. Wall Street also braced itself for a busy week of earnings. About 200 S&P components are set to report this week, including Google-parent Alphabet, Microsoft and 3M. Of the 95 S&P 500 companies that have reported as of Monday morning, 77 percent exceeded earnings expectations, according to data from The Earnings Scout. The Dow Jones industrial average rose 216.13 points, or 1.05 percent, to close at 20,763.89, with JPMorgan Chase outperforming and Nike the top decliners. The S&P 500 gained 25.46 points, or 1.08 percent, to end at 2,374.15, with financials leading nine sectors higher and real estate and telecommunications lagging. The Nasdaq advanced 73.30 points, or 1.24 percent, to close at 5,983.82. About three stocks advanced for every decliner at the New York Stock Exchange, with an exchange volume of 907.07 million and a composite volume of 3.647 billion at the close. The CBOE Volatility Index (VIX), widely considered the best gauge of fear in the market, traded near 10.9, down 25.6 percent. Monday Earnings: Alcoa, Newmont Mining, Kimberly-Clark, Illiinois Tool Works, Hasbro, Halliburton, Whirlpool, Express Scripts, Ameriprise, Range Resources, Canadian National Railway, J&J Snack Foods, Owens-Illinois, Crane Tuesday Earnings: Caterpillar, 3M, Coca-Cola, McDonald's, Dupont, Eli Lilly, Novartis, AutoNation, Baker Hughes, SAP, Biogen, AT&T, Lockheed Martin, PulteGroup, Freeport-McMoran, JetBlue, AK Steel, Polaris, Paccar, Valero Energy, Xerox, TransUnion, Arconic, Capital One, Chipotle Mexican Grill, Discover Financial, U.S. Steel, Juniper Networks, Stryker, Panera Bread, United Health Services, Valvoline 9:00 a.m. S&P Case-Shiller home prices 9:00 a.m. FHFA home prices 10:00 a.m. New home sales 10:00 a.m. Consumer confidence Wednesday Earnings: Boeing, Daimler, Fiat Chrysler, Pepsico, United Technologies, GlaxoSmithKline, Anthem, Alaska Air, Northrop Grumman, General Dynamics, Dr. Pepper Snapple, Hershey, Norfolk Southern, State Street, Credit Suisse, Hess, Seagate Technology, Twitter, Nasdaq, Amgen, Paypal, F5Networks, Tractor Supply, Buffalo Wild Wings, Boston Beer, SixFlags, CR Bard, Whiting Petroleum, Suncor Thursday Earnings: Alphabet, Microsoft, Intel, Amazon.com, Raytheon, Baidu, Starbucks, Expedia, Comcast, Bristol-Myers Squibb, Flex, GoPro, Western Digital, Vertex , Sirius XM Radio, Under Armour, American Airlines, Southwest Air, MGM Growth, Generac, Domino's Pizza, CME Group, KKR, Johnson Controls, Union Pacific, UPS, Total, Celgene, Deutsche Bank, Alexion Pharma, Nintendo, AbbVie, Bayer, Air Products 7:45 a.m. ECB rate decision 8:30 a.m. ECB President Mario Draghi press briefing 8:30 a.m. Jobless claims 8:30 a.m. Durable goods 8:30 a.m. Advance econ indicators 10:00 a.m. Pending home sales 10:00 a.m. Housing vacancies Friday Earnings: Exxon Mobil, Chevron, Colgate-Palmolive, Honda Motor, Barclays, UBS, Sony, Synchrony Financial, Spirit Airlines, Autoliv, Sanofi, Spirit Airlines, Goodyear Tire, Calpine, Cabot Oil and Gas, Phillips 66, Weyerhaeuser 8:30 a.m. Q1 adv Real GDP 9:45 a.m. Chicago PMI 10:00 a.m. Consumer sentiment 2:30 p.m. Philadelphia Fed President Patrick Harker Watch: Rally will be earnings based ","Dow closes 200 points higher, Nasdaq posts record session after French election"
Sean Williams,04272017,Fool,04202017,"Founded in 1993 by brothers Tom and David Gardner, The Motley Fool helps millions of people attain financial freedom through our website, podcasts, books, newspaper column, radio show, and premium investing services. The Dow Jones Industrial Average (DJINDICES:^DJI) is one of the America's oldest stock indexes, and it's easily the country's most iconic. It's comprised of 30 huge multinational corporations, all of which have demonstrated a penchant for creating shareholder value over the long run. Image source: Getty Images. For example, conglomerate General Electric is the sixth-largest company represented in the Dow, with a market cap of roughly $260 billion. But its share price is less than $30. Based on the current Dow divisor, which translates the share prices of Dow components into the point value that we follow as investors, GE's share price contributes just 202 of the Dow's 20,548 points, the closing value as of Friday, April 21. That's not even a full 1%. Yet, a company we'll be discussing in a moment that has just 30% of the market cap of GE also has seven times its influence in the Dow, all because of share price. In fact, through Friday, the Dow would be 308 points higher if the following three companies were merely flat for the year instead of down between 9% and 11%. Though it doesn't happen often, Goldman Sachs (NYSE:GS) missed Wall Street's expectations by a wide margin in the first quarter, and that's the primary reason it's shaved nearly 155 points off the Dow year to date. It's also the aforementioned company that has seven times as much influence on the Dow as GE based solely on its share price. Image source: Getty Images. For the first quarter, Goldman wound up reporting $5.15 per share in EPS on $8.03 billion in revenue. Comparatively, Wall Street was looking for $420 million more in revenue and $0.16 more in earnings per share. Goldman attributed its subpar results to weakness in certain market segments. For instance, even though investment banking revenue scorched higher by 16% year over year, revenue from fixed income was flat, while equity revenue dipped 6% on account of weaker volumes in the United States. The low interest rate environment continues to hold back Goldman Sachs, which is listed as a bank in name, but is really an investment institution by practice. The good news is that at least the Federal Reserve is in the midst of tightening monetary policy, albeit slowly. As rates rise, investor demand for fixed-income assets will likely improve as well. This should reduce market volatility and give the king of bonds, Goldman Sachs, some healthy profits. But it's going to take time before the bond market is a boon once again for Goldman Sachs. In the interim, it's been quite the drag on the Dow in 2017. Integrated oil and gas companies have regularly taken it on the chin over the past three years. Surprisingly, though, Chevron (NYSE:CVX) has held up better than many of its peers. Its geographic diversity and ability to cut costs probably played a key role in its ability to withstand sinking crude oil prices. Image source: Getty Images. However, in 2017 Chevron has been notably weaker. On a pure percentage basis, Chevron is the worst-performing stock in the Dow year to date, and it's removed almost 88 Dow points. The failure of crude prices to move higher is one reason Chevron is struggling. Despite cuts from OPEC that were expected to reduce supply and help buoy crude prices, U.S. crude and gasoline inventories hit an all-time record high in mid-February. This picture paints the need for more production cuts in the future, and more importantly, shows there is no quick fix for crude oil prices. The other issue for Chevron is that its fourth-quarter earnings results, released earlier this year, weren't very encouraging. Despite the company's $415 million in net income during Q4 2016, there were a handful of disappointments. For instance, Chevron's operating cash flow is still not high enough to cover the costs of paying out its dividend. Chevron has admittedly worked hard to become a Dividend Aristocrat (i.e., a company that's increased its payout for 25 or more consecutive years) and likely doesn't want to give up that title, but it's being forced to issue debt to cover a portion of its payouts at the moment. Additionally, the company's U.S. downstream operations produced no earnings as a result of a 21% decline in per-day output, which Chevron blamed on planned turnaround activity at its refinery in Richmond, California. The good news for investors is that Chevron still has plenty of cost-cutting channels left, as well as numerous projects that are poised to boost production over the long term. However, an ongoing crude supply glut is a problem that isn't likely to be resolved anytime soon. Finally, ExxonMobil (NYSE:XOM) is in much the same boat as Chevron. Its stock has held up far better than many of its peers, but rising U.S. crude and gasoline inventories clearly have investors concerned. This year hasn't been so kind to big oil stocks, with ExxonMobil removing more than 65 points from the Dow in 2017. Image source: Pixabay. Though ExxonMobil's fourth-quarter report was a bit more upbeat than Chevron's -- after all, it was able to cover its dividend payouts with cash flow generated from operations and asset sales -- it still came with some clear downsides. For instance, ExxonMobil wound up taking an impairment charge of about $2 billion in its U.S. upstream segment that was tied to undeveloped acreage in the Rocky Mountains. The company also saw its full-year 2016 earnings hit by weaker refining margins, although this was a sectorwide issue last year. And, for those shareholders who've become accustomed to ExxonMobil being exceptionally generous with share buybacks, there's been a notable decline in the number of shares it's repurchasing. Like Chevron, ExxonMobil has the ability to reduce its expenditures to account for weakened demand or modestly lower commodity prices. Its Q4 2016 capital expenditures were down 35% from the prior-year quarter, to $4.8 billion. These are the types of steep cuts that may be needed if ExxonMobil wants to keep its healthy dividend firmly in place. ExxonMobil has ample projects underway to boost production in the years to come, but without oil industry dynamics favoring the company, it could be tough sledding in 2017. ","
      
    The Dow Would Be More Than 300 Points Higher This Year if Not for These 3 Stocks -- The Motley Fool

  "
Bradley Seth McNew,04272017,Fool,04202017,"Founded in 1993 by brothers Tom and David Gardner, The Motley Fool helps millions of people attain financial freedom through our website, podcasts, books, newspaper column, radio show, and premium investing services. Image source: Getty Images. Image source: ExxonMobil. First up is the oil and gas behemoth ExxonMobil (NYSE:XOM), which gave more than a quarter of a billion dollars in 2015 alone (the most recent year for which data is available). The company has spread its donation efforts across various areas, from education to global health initiatives to malaria prevention. ExxonMobil also has a program to donate $500 on behalf of an employee for every 20 hours the employee volunteers. Goldman Sachs employees volunteering in Bangalore in 2016. Image source: Goldman Sachs. A community knowledge center in Kenya. Image source: Cisco Systems. Cisco Systems (NASDAQ:CSCO) is already using its data and cloud computing technology to help develop ""smart cities"" around the world in places like Copenhagen, Denmark. But the company also uses its funding and technology to build ""Community Knowledge Centers"" in areas that lack internet access, such as in Kenya, as shown in the image above. These centers allow local residents to connect to online resources such as skills training. Cisco's management believes investments like these are critical to ending the cycle of poverty in these areas. Image source: Wells Fargo. While Wells Fargo (NYSE:WFC) has certainly come under public scrutiny over its problematic account-selling tactics in the last few months, the company has long been regarded as one of the most charitable for-profit organizations in the U.S. Wells Fargo supports hundreds of local nonprofits in the cities where it operates, as well as large national nonprofits that are involved in financial education and much more. Wells Fargo management announced its 2020 economic goals last year, and they include $500 million in philanthropic spending by 2020. Image source: Eli Lilly. Eli Lilly (NYSE:LLY) is the maker of important pharmaceutical products like Prozac and insulin. It's also the parent of the Eli Lilly Foundation, which awards grants for philanthropic initiatives in the areas of quality healthcare in low- and middle-income countries, as well as public education in the United States, with an emphasis on science and math. The foundation also matches millions of dollars' worth of employee donations each year. Image source: Bristol-Myers Squibb. Healthcare company Bristol-Myers Squibb (NYSE:BMY) says on its website that it seeks ""to improve the health outcomes of populations disproportionately affected by serious diseases"" through increasing healthcare worker capacity and integrated medical care. The company recently announced a $50 million donation (matched with another $50 million from other donors) in a new public-private partnership with the government of Botswana to treat children with cancer and blood disorders. Microsoft employee Prashant Gupta in India. Image source: Microsoft. Microsoft (NASDAQ:MSFT) founder Bill Gates is not only one of the wealthiest people in the world, but also one of the most charitable -- he's the co-founder of the Bill and Melinda Gates Foundation, which has donated tens of billions toward the cause of improving healthcare and relieving poverty around the world. Microsoft seems to hold similar values, as the company notes that it donates nearly $2 million per day in cash and equipment. Its philosophy is that technology can help humankind overcome some of the greatest challenges it faces. In the image above, a Microsoft employee helps farmers in India use technology to better time their crops during a drought. Google Cardboard headset being used to help veterans virtually attend a Veterans Day Parade. Image source: Google.org. Alphabet's (NASDAQ:GOOG)(NASDAQ:GOOGL) philanthropic efforts include donating its own services -- for example, it gives nonprofits free access to Google Adwords for advertising, and trains military veterans to learn new technologies as they transition to civilian jobs. The company also launches bold technological ventures that are meant to take dramatic steps toward solving the world's problems. For instance, the company provides funding and expertise to groups that can use the Google Earth tool to fight global deforestation. Image source: Wal-mart. Wal-Mart (NYSE:WMT) is the world's largest retailer by sales, and it also holds the spot as the largest donor in the retail industry. The company gives cash and product donations to nonprofits working on labor benefits, food for those in need, and much more. The company also sends aid to communities in the U.S. that are affected by natural disasters. In December it gave $250,000 toward relief and recovery efforts in areas of Tennessee that were being ravaged by wildfires. Image source: Merck & Company. Merck & Co., a leading healthcare company, donates both cash and medical resources, particularly within the communities where the company operates. It also aids in global initiatives to take on cancer, diabetes, hepatitis C, and HIV/AIDS. The company notes on its website that it donated $1.7 billion worth of products in 2015 alone. Image source: Getty Images. The second-largest corporate donor as of 2016 is Gilead Sciences (NASDAQ:GILD). Gilead is one of the leaders in HIV/AIDS pharmaceuticals. Its products include a medication called Truvada, a form of pre-exposure prophylaxis (PrEP) that blocks the virus from spreading between individuals. The company's top philanthropic priority is ending the global HIV/AIDS epidemic and making life-saving healthcare accessible in areas of need. Image source: Pfizer. The most charitable Fortune 500 company in America is Pfizer (NYSE:PFE). This healthcare company, which makes famous drugs like Viagra and Lipitor, seeks to build out healthcare opportunities for those in underserved communities worldwide through ""people, products, and funding."" As part of this goal, the company helps to fund programs that increase awareness of non-communicable diseases and that remove barriers preventing women and children from receiving sufficient care. ","
      
    America's 12 Most Charitable Companies -- The Motley Fool

  "
