Author,EndDate,Site,StartDate,Text,Title
Catherine Clifford,05042017,CNBC,04272017,"As the school year comes to a close, internship season is kicking off for many students. But not all interns make coffee runs for no pay. In particular, in finance and tech, college interns are paid very well with lots of perks. Facebook summer interns, for example, earn almost twice what the average American worker makes — $8,000 per month working at Mark Zuckerberg's social media behemoth, according to a new report from jobs website  Glassdoor. Annualized, that's $96,000. The average U.S. worker makes $51,350,  according to March 2017 data, also from Glassdoor. Here's a look at the 25 highest-paid internships in America and what it's like being a summer intern at these companies. Observations are pulled from anonymously submitted feedback on Glassdoor. 1. FacebookMedian monthly pay: $8,000The good: ""Amazing perks (free food, snacks, transportation, housing -- own bedroom and bathroom!), as well as completely paid-for intern events on the weekends.""The bad: ""Difficult to switch teams and try other options as an intern. ... My team, excluding my manager, also all worked remotely, which made getting help very hard."" — Software engineer intern in Menlo Park, Calif. 2. MicrosoftMedian monthly pay: $7,100The good: ""Meaningful intern projects. Great diversity of teams: Microsoft has their hands on absolutely everything, so you get to talk to a lot of very smart and interesting people. Probably has the best intern benefits out there. Intern events are amazing. I've had great mentors. It's a great time to join Microsoft in the midst of its reinvention.""The bad: ""The internship experience depends a lot on the mentor. Most mentors are great; if you're one of the unlucky few, your internship won't be as rewarding."" — Software engineer intern in Redmond, Wash. 3. ExxonMobilMedian monthly pay: $6,507The good: ""Great place to start and develop a career. There is a major focus on professional development and management takes your interests very seriously.""The bad: ""It can be difficult to contribute meaningfully at times."" — Software development intern in Houston, Texas 4. SalesforceMedian monthly pay: $6,450The good: ""Salesforce truly does a great job of making you feel like a part of the team. They have been very helpful throughout my career."" The bad: ""Getting to be a pretty massive company, losing some culture that made it so special. However, it would be almost impossible not to at this point."" — Client service intern in Atlanta, Ga. 5. AmazonMedian monthly pay: $6,400The good: ""Great supervisor, great benefits, great location, great work experience. I learned a ton in this position that I believe will serve me well in future endeavors.""The bad: ""The full-time post graduation offer was difficult because you don't get to know your location until about a month before you start work — so I had to turn it down."" — Intern in Dallas, Texas 6. AppleMedian monthly pay: $6,400The good: ""Very innovative culture, supportive teammates and management; it's run like a series of small startups instead of global company, makes it very easy to take ownership of work.""The bad: ""Secrecy got in the way of productivity."" — Hardware engineering intern in Sunnyvale, Calif. 7. Bloomberg L.P.Median monthly pay: $6,400The good: ""Phenomenal company culture, which makes employees excited about coming to work everyday. Great benefits and access to cultural institutions. Beautiful office space in a great part of Manhattan — free food, drinks, etc.""The bad: ""Bloomberg's company culture is strong, which is a huge positive of the company, but is negative to some in the sense that there is not that much room to change the path that they have designed."" — Intern in New York, N.Y. 8. YelpMedian monthly pay: $6,400The good: ""Yelp has an amazing company culture. Everyone comes in to work so positive and I genuinely enjoyed everyone I worked with. Your managers are very helpful and are well-trained in guiding you through a challenging role. The free food is definitely a plus.""The bad: ""The work is very monotonous, which can be very hard to endure day in and day out. You face a lot of rejection, which you need to not take personally, but that is very hard to do some days. Overall, the role is for some and not for others. ... You have to be very resilient."" — Sales intern 9. YahooMedian monthly pay: $6,080The good: ""Interns get to work directly with the full-time employees and get a real feel of how full-timers work.""The bad: ""I think a significant con would be the general lack of innovation from the company. People may not be connected to their products."" — Intern in Sunnyvale, Calif. 10. VMwareMedian monthly pay: $6,080The good: ""All of my colleagues were willing to either help me when I got stuck or aim me at the right person to ask -- there was no, 'I'm too busy to help you' mentality there. Also, VMware has a 'use as much time off as you need' policy. As long as you're getting your work done and clear it with your manager, you can take as much vacation as you want.""The bad: ""With the Dell acquisition of EMC, there is some uncertainty of how that will affect VMware. However, the message from management is that things will continue 'business as usual.'"" — Ph.D. intern in Austin, Texas 11. GoogleMedian monthly pay: $6,000The good: ""You get to be a part of incredible projects that have huge impacts on many users around the world. Very motivating environment!""The bad: ""Can be rough sometimes, you're surrounded by very smart people and it can be intimidating. You have to learn to work fast."" — Software engineer intern in Mountain View, Calif. 12. NVIDIAMedian monthly pay: $5,770The good: ""State-of-the-art technologies. Interns are given real projects, i.e., you are given tasks which otherwise would be assigned to full-times. Extreme flexibility in choosing/changing tasks/projects. Smart (even legendarily) people; you sometimes meet and work with people whose books you read in the grad school.""The bad: ""Campus needs a refresh, but it hopefully will happen with a new Endeavor building. Infrastructure and tools must be improved — too much time wasted on fighting with repositories, building and testing systems. FB/Google/MS give better salary."" — Systems software engineer intern in Santa Clara, Calif. 13. IntuitMedian monthly pay: $5,440The good: ""Amazing people and culture. Happy and relaxed doing the best work of their lives. Great benefits, bleeding-edge tech, meaningful work and delighted customers.""The bad: ""Can be a bit slower if you're used to a faster-paced company. That is changing now though. Pace of work has increased since I've started."" — Software engineer intern in Mountain View, Calif. 14. Juniper NetworksMedian monthly pay: $5,440The good: ""Super friendly, everyone is a big team. The company makes an effort to keep you. Cheap food, nice company outings. Great environment.""The bad: ""Big company, hard to make an impact. Sometimes it seems that your advice might fall on deaf ears because the company is so large."" — Facilities engineer intern in Westford, Mass. 15. WorkdayMedian monthly pay: $5,440The good: ""Had such a great summer due to this internship. They housed us and had events for us all the time. The employees here are mostly all really nice and the other interns were cool. Working wasn't ever really stressful and felt laid back.""The bad: ""If you're in app dev, working in their proprietary language somewhat limits your learning experience for the internship. I felt like I didn't have time to really learn it that well and therefore didn't do as much through the summer."" — Associate applications developer intern in Pleasanton, Calif. 16. BlackRockMedian monthly pay: $5,400The good: ""Huge company with lots of opportunities. Respected and dominant in the industry.""The bad: ""Bureaucracy and silo effect between teams."" — Summer associate in New York, N.Y. 17. AdobeMedian monthly pay: $5,120The good: ""Lots of benefits, great employee perks and events, including a chance to have a meeting with the CEO. Became a full member of a team for three months.""The bad: ""A bit of bureaucracy involved in dealing with international team members, and having many remote teammates certainly diminished the experience."" — Computer science intern in San Francisco, Calif. 18. MathWorksMedian monthly pay: $5,120The good: ""The work that MathWorks does is pretty awesome and you end up learning a lot. Most developers are young and are quite brilliant. The atmosphere is pretty laid back and there doesn't seem to be too much pressure on people. Close to Boston, which is a very happening town.""The bad: ""Sometimes people take a lot of time to respond, which might be due to the laid back attitude in general. Also the salary is probably a little lower than the industry average."" — Software developer intern in Natick, Mass. 19. QualcommMedian monthly pay: $5,040The good: ""You get to work on interesting projects. Great teamwork, side projects, hackathons. Meaningful projects that will impact the company.""The bad: ""If you are not an engineer, you might feel left out at the beginning. There are some activities specifically for engineering interns."" — Intern in San Diego, Calif. 20. Capital OneMedian monthly pay: $5,000The good: ""Very focused on getting you acclimated to the company. Well-managed program, structurally. Top management commitment to program gives interns exposure to high level associates in the bank.""The bad: ""Little opportunity to give and get honest feedback to program management— internship feeds into the Finance Rotation Program (FRP) where employees have little say on the types of roles they will be assigned."" — Intern in McLean, Va. 21. ChevronMedian monthly pay: $5,000The good: ""As an intern, you are given hands-on real problems and can really dig into and learn what you are doing. They never have you doing administrative tasks, you are treated like a true employee and not an intern. The company culture is great, mostly everyone really does follow 'the Chevron Way,' which creates a good work environment.""The bad: ""Because of the history of the industry, there isn't a lot of diversity. One summer I was one of maybe 10 females that worked on the entire floor, which was about 50-60 people."" — Environmental specialist intern in Houston, Texas 22. AccentureMedian monthly pay: $4,960The good: ""The people there made the job and long hours a much more fulfilling experience. I liked them a lot. The work was plentiful but it was fast paced. The pay was good for an intern.""The bad: ""There wasn't a whole lot that I could really complain about. The hours were long, variable, and I had to work some weekends, but that is nothing to complain about. Time and expense sheets are very tedious."" — Intern in Houston, Texas 23. Deutsche BankMedian monthly pay: $4,640The good: ""Deutsche Bank is a very reputable firm with a great name in the banking world, especially in Europe. Great people, challenging problems, interesting work and great team-oriented culture.""The bad: ""Work/life balance is tough in investment banking. Didn't like that you had no control over your schedule and that you had limited say in your work."" — Technology investment banking summer analyst in Boston, Mass. 24. AIGMedian monthly pay: $4,616The good: ""The people there are really nice and eager to help me with all my questions. Got to learn a lot of different lines of business and models they use.""The bad: ""Some of the teams [where] the interns got placed are not at their busy season, so some interns may not be able to touch the core of the team projects because there are no projects for them to do at that moment."" — Summer actuarial analyst in New York, N.Y. 25. Bank of AmericaMedian monthly pay: $4,570The good: ""Good corporate culture, good intern pay, great training, great coworkers. Possibility for full-time employment once the internship is over.""The bad: ""Sort of the same thing every day. If you like that, it's great. If you don't, it can get tedious or boring."" — Summer credit analyst intern in Fresno, Calif. Data is a real-time snapshot *Data is delayed at least 15 minutesGlobal Business and Financial News, Stock Quotes, and Market Data and Analysis Data also provided by © 2018 CNBC LLC.  All Rights Reserved. A Division of NBCUniversal ","Facebook, Apple, Google and the 22 other companies offering America's highest-paid internships"
"Tim Mullaney, special to CNBC.com",05042017,CNBC,04272017,"With Apple set to report second-quarter profits Tuesday, it's only a little bit of an exaggeration to say all of Wall Street's about to get a little bit of a raise. That's because the spring is when Apple typically announces its annual dividend hike. After a 24 percent jump in Apple shares this year, their yield is just about 1.6 percent, well below its peak and even below the yield of the Standard & Poor's 500 and its corresponding ETFs like IVV and SPY which yield roughly 1.9 percent. And that matters, even to people who don't directly own Apple shares, because the world's most-valuable company —that is sitting on a stockpile of cash that has topped $250 billion — is a core holding of both index mutual funds and the inexpensive exchange-traded funds held by more than 5 million U.S. households, according to the Investment Company Institute. ""This is normally the quarter when they talk about (dividends and stock buybacks) and we expect it to be the focus,'' said CFRA Research analyst Angelo Zino. ""No one will really care about the iPhone results ahead of a massive launch of the iPhone 8 [in September]."" Everybody has a stake in Apple this year in particular, since the stock's recent run to as high as $145 from about $92 last June has been driving indexes and index funds. One measure of Apple's recent importance: It accounts for almost 30 percent of the gain in the Dow Jones Industrial Average since it hit 20,000.The next-most important stock in the 6 percent-plus rise for Dow ETFs this year — DIA and IYY — has been airplane giant Boeing. In the world of ETFs, Apple shares loom large. Apple is roughly 15 percent of the S&P 500 Technology Index ETF (XLK) and 17 percent of the $3.3 billion iShares U.S. Technology Fund (IYW). Apple is 3.66 percent of the S&P 500 ETF, according to Morningstar. The dividend announcement is likely to accompany an expansion of Apple's stock buybacks, perhaps by as much as $45 billion to $50 billion, according to an estimate done by Goldman Sachs analyst Simona Jankowski. Its not a shareholder reward program Apple tends to divulge details on until later in the year, but CFRA analyst Zino suggested that may change if details President Trump's plans to allow low-tax repatriation of offshore corporate cash holdings become clear — it was not presented with any detail in the tax reform overview provided by the White House last week. Apple CEO Tim Cook has said the company has allocated several billion dollars of its offshore holdings for buybacks as soon as the company can move the money into the U.S. without paying U.S. corporate taxes on it. Most market watchers, noting that as much as three-fourths of cash repatriated during a tax holiday on foreign profits while George W. Bush was president — even though it was technically prohibited by Congress — expect Apple to pay out much more. ""They could reduce the share count another 20 percent if they get the repatriation effect,"" Zino said. More from ETF Strategist:The death of active management in one article
Tesla's ETF problem
Playing Elon Musk's energy agenda through ETFs The company has been returning capital to holders of shares since 2012, when it instituted a buyback and dividend in response to pressure from activist investor Carl Icahn. Apple's initial dividend was the largest ""dividend increase"" in the S&P 500 ever, according to S&P Global Market Intelligence data. About 94 percent of its $246 million in cash and securities is held overseas, as the company uses most domestic profits for reinvestment and return to shareholders, supplemented by money the company has borrowed for buybacks. Apple raised its quarterly dividend, currently 57 cents, by a nickel each of the past two years, while buybacks have reduced Apple's shares outstanding by almost 20 percent, worth about $150 billion at today's share price. The amount Apple spends on dividends, about $12 billion last fiscal year, has been nearly unchanged because the higher payout is offset by the shrinking number of shares, Zino said. The company's yield since 2012 has fluctuated between about its current level and about 2.4 percent, fluctuating with Apple's stock price. In February, RBC Capital analyst Amit Daryanani suggested the company could afford to boost its payout to 4 percent, though Zino considers such a sharp move unlikely, and Apple has played it safe with dividend raises in recent history rather than meet more aggressive wishes from Wall Street and investors. Dave Nadig, CEO of ETF.com, said investors interested in Apple as a dividend play still have to come back to an obvious fact: ""The way to play Apple (or any other company) isn't with an ETF, it's with the stock,"" Nadig said. ""Of course, if you are trying to participate in the broad market you want some exposure to Apple. That's the beauty of a cap-weighted index. If you own a total market ETF your exposure to Apple is exactly as important as the entire stock market has decided it is."" Another modest boost wouldn't goose shares of Apple, or the funds that hold its stock, much higher in the near term. But a higher payout would buttress the foundation for longer-term returns for Apple's owners. Dividend stocks have always been safe havens in a volatile market, but they're tanking in 2018. Don't give up yet. ETF investors concerned about the North Korea–US standoff are looking at ways to reduce risk in their portfolios. It gets a lot of attention, but the Dow is an unpopular investment in an era of index funds. Weakness in stocks, including Lowe's, Home Depot and Whirlpool, may be a sign the record housing prices can't last. A look at 50 private companies set to reshape the business landscape. Frontline insights and unique views on key issues and challenges facing today’s CFOs. Unlock the keys to building a successful long-term financial plan: manage your money, grow your money, and protect it. Jim Cramer reveals how Bausch Health has put together an amazing comeback. Jim Cramer flags an opportunity in shares of data-focused technology play Dropbox in the lightning round. Jim Cramer and technician Larry Williams outline some potentially lucrative trades in the retail sector. Thomas B. Michaud, president and chief Executive Officer at Keefe, Bruyette & Woods, discusses his outlook on the financial sector with CNBC’s Michael Santoli. Bonds that retirees depend on for income, and that savers depend on for market safety, are seeing huge declines this year. But with the Dow dropping and many S&P 500 stocks in correction, investors need a bond strategy. Ignoring them isn't one. CNBC’s Mike Santoli breaks down the move among investors to ‘quality stocks’ over risky, high-growth companies. ",Will Apple's annual dividend decision give America a raise?
Reuben Gregg Brewer,05042017,Fool,04272017,"Founded in 1993 by brothers Tom and David Gardner, The Motley Fool helps millions of people attain financial freedom through our website, podcasts, books, newspaper column, radio show, and premium investing services. Despite a lingering oil sector downturn, ExxonMobil Corporation (NYSE:XOM) has remained an industry leader. For example, unlike many peers, it's been profitable throughout this difficult period and it's continued to increase its dividend annually  for 34 years and counting. While investors can take solace in the oil and gas giant's business performance, that doesn't mean the very real issues clouding the company's outlook can be ignored. Here are three challenges facing ExxonMobil Corporation today. Low oil prices have an impact throughout Exxon's business. On the one hand, cheap oil actually helps the company's refining and chemicals operations because it means a key feedstock is, well, cheap. That, in turn, helps these businesses widen margins and make more money. This highlights a key advantage of Exxon's integrated business model. But if prices go up, margins will get squeezed. Image source: ExxonMobil Corporation And then there's oil drilling, which is the largest part of the business. In the second quarter of 2014, before oil prices started a precipitous plunge from over $100 a barrel to a low around $30, Exxon's upstream segment had earnings of nearly $7.9 billion. In the fourth quarter of 2016, after prices had recovered from their lows to the $50 range, upstream earned roughly $1.4 billion. That figure is after taking out the impact of an asset impairment charge that pushed it nearly $650 million into the red. The benefit of low oil prices can offset only a portion of the pain when it's on that scale. In other words, oil will continue to drive results up and down, and there's little Exxon can do about that. That said, the company has used the downturn to invest in new assets that should help enhance its flexibility in a low-oil-price world (more on the pros and cons of that below). . Oil prices have a direct impact on the second big issue facing Exxon: maintaining reserves. From a big-picture point of view, oil companies have a set amount of oil and natural gas in the ground. Every barrel they pull up is one less barrel available for the future. Which is why oil companies are always on the lookout for new sources of oil. In 2016 Exxon replaced only about two-thirds of the oil it produced. That was the first time in more than two decades that it didn't replenish its reserves with at least the amount it drilled. Replacement numbers go up and down, so one year isn't enough to indicate a problem...yet. The issue is that low oil prices make it harder to find profitable oil to replace what's pulled up, let alone enough to actually grow reserves. When oil is over $100 a barrel, companies can drill almost anywhere profitably (that's hyperbole, but you get the idea). When oil is at $30 a barrel, it's awfully hard to justify spending much money on anything. That said, Exxon recently announced a large oil discovery in offshore Guyana. It's also expanded its footprint in the U.S. onshore space via an acquisition that roughly doubled its Permian basin holdings. Both should help support its reserves over time. And Exxon has plans to up its capital spending over the next few years, too. Still, keep an eye on reserves: If the situation doesn't improve Exxon will have a major long-term problem. The Permian acquisition is notable because it indicates a shift in the company's thinking. Historically, Exxon has focused on large and expensive projects that took years to complete. That's pretty much the specialty of big integrated oil companies. Although Exxon is hardly abandoning such projects, low oil prices make it harder to justify those investments. Exxon is shifting away from giant oil projects over the near term. Image source: ExxonMobil What the Permian purchase suggests is that the oil giant is looking to increase its flexibility by increasing its exposure to onshore U.S. drilling, which is easier to ramp up and down as oil prices change. That surely adds flexibility, but it's a different approach than Exxon has taken in the past and it could limit the company's ability to provide investors with industry leading investment returns. The U.S. onshore space simply doesn't offer the same returns as large projects. The increased focus on so-called ""short cycle"" projects (U.S. onshore) is coupled with continued investment in Exxon's downstream chemicals and refining businesses. The downstream business tends to have thinner margins than the upstream segment. In the end, more than half of Exxon's capital spending between now and 2020 is projected to support investments that don't provide the same return as big projects. That's potential headwind to Exxon living up to its past successes. On the plus side, all of this should help to diversify Exxon's business. And that should make returns more stable over time, which isn't necessarily a bad thing if you are looking for a stable dividend paying business. Although Exxon just went through a leadership change, the company is pretty insular and changes relatively slowly. That's not a bad thing in this case, since Exxon has long been an industry leader. I believe strongly that it will survive this downturn and prosper again -- otherwise I wouldn't own it. However, my confidence doesn't alter the fact that the company has to deal with low oil prices and their impact on earnings. Or the impact that cheap oil has on finding profitable new oil resources. And then there's the company's increasing focus on businesses that don't offer the same bang for the buck as the giant oil projects for which Exxon is known. There are clearly risks here. That said, all of this bad news could be a good opportunity for long-term investors since the yield is toward the high end of its historical range. But you have to believe Exxon can survive the notable challenges it's facing today, and thrive in the future if you are going to pull the trigger here. ","
      
    3 Biggest Challenges Facing Dividend Giant ExxonMobil Corporation -- The Motley Fool

  "
